rank,task_id,target,status,why,primary_gap,commands,exit_criterion,paper_use
1,genimage_official_split_eval,GenImage official or paper-compatible splits,ready_when_data_available,This is the cleanest academic SOTA bridge: a public benchmark family with generator and degradation splits.,No official GenImage run; current evidence is Ishu/MS COCOAI proxy transfer only.,"Train frozen CLIP/SCP-Fusion branches on the chosen source split, then run `python scripts/evaluate_frozen_encoder_model.py --model-dir <clip_run> --target-dir <genimage_target> --output-dir <out>` and `python scripts/evaluate_feature_model.py --model-dir <combined_v3_run> --target-dir <genimage_target> --output-dir <out>`.","Report per-generator and degraded-split accuracy/AUC for CLIP, DINOv2, combined_v3, physics-guided, and SCP-Fusion.",Turns SOTA comparison from methodological to benchmark-backed.
2,ntire_released_protocol_replay,NTIRE 2026 released train/validation protocol or NTIRE 2027,blocked_on_official_labels_or_next_cycle,NTIRE is the strongest robustness SOTA anchor; current best proxy AUC is below the official robust top score.,No official NTIRE score; current NTIRE-style proxy rows are marked `proxy_not_official`.,"Once labels/splits are available, run source-aware SCP-Fusion and robustness transforms with the same ROC-AUC reporting; keep official and proxy outputs in separate report IDs.","Produce an official or released-split ROC-AUC table with clean, transformed, and average robust scores.",Needed for any future NTIRE/SOTA leaderboard claim.
3,high_res_tiled_foundation_eval,Ishu/MS COCOAI plus future GenImage/RealHD high-resolution slices,fused_reverse_pass_complete,The current native-tiling gain only tiles the conventional branch; official SOTA systems often exploit high-resolution local evidence.,"CLIP, DINOv2, and ConvNeXt reverse-transfer tiling are benchmarked and folded into a fixed reverse SCP-Fusion diagnostic; source-heldout and transform-stress checks are still pending.","Run `python scripts/build_tiled_foundation_comparison.py` and `python scripts/build_tiled_foundation_fusion_comparison.py`; next, stress the best DINOv2/ConvNeXt tiled fusion modes under JPEG, blur, resize, and screenshot transforms.",Show whether the fused tiled-foundation gain over 0.8472 AUC survives source-heldout selection and resize/blur stress losses.,"Strengthens SCP-Fusion as a forensic, high-resolution protocol instead of a resized-image classifier."
4,reconstruction_branch_ablation,"Ishu/MS COCOAI, then GenImage degraded splits",implementation_next,AEROBLADE/FIRE-style reconstruction signals are a major SOTA direction and are not yet a full branch here.,"combined_v4 includes lightweight reconstruction proxies, but no pretrained reconstruction detector branch.","Add cached autoencoder/diffusion-reconstruction residual features, then evaluate them alone and in SCP-Fusion with source-heldout calibration.","Report whether reconstruction features beat combined_v3 or improve SCP-Fusion transfer/robustness under JPEG, blur, and resize.",Makes the physics/conventional branch more competitive with current reconstruction-based forensics.
5,source_diverse_training_scaleup,MS COCOAI plus recent generated-image datasets,data_next,SOTA robustness depends heavily on source diversity; current transfer results show strong threshold and generator-shift sensitivity.,Training sources are much narrower than NTIRE-style 42-generator protocols.,"Expand the dataset catalog, train repeated seeds with `python scripts/run_repeated_benchmark.py --data-dir <source> --out-dir <runs> --seeds 7 17 29 -- ...`, and evaluate leave-one-generator-out.",Show improved heldout-source AUC/fake-call balance without target tuning.,Separates model weakness from dataset/source-coverage weakness.
6,imageclef_next_cycle_packaging,ImageCLEF 2027-style no-training/public-submission protocol,watchlist,ImageCLEF rewards robust packaging and clear operating points; our triage evidence is a natural fit.,No ImageCLEF 2026 task data or submission.,"Package the inference path as a single runner that emits per-image scores, labels, and confidence/triage decisions without training-time leakage.",A dry-run submission folder can be produced from any image folder with a stable manifest and score CSV.,Makes the repo competition-ready for the next open cycle.
